{
  "user_id": "500123",
  "device_id": "500123",
  "event_type": "standard",
  "time": 1718153645993,
  "event_properties": {},
  "user_properties": {},
  "groups": {},
  "group_properties": {},
  "app_version": "example_value",
  "platform": "example_value",
  "os_name": "Example Name",
  "os_version": "example_value",
  "device_brand": "example_value",
  "device_manufacturer": "example_value",
  "device_model": "example_value",
  "carrier": "example_value",
  "country": "example_value",
  "region": "example_value",
  "city": "example_value",
  "dma": "example_value",
  "language": "example_value",
  "price": 27.84,
  "quantity": 454,
  "revenue": 87.02,
  "productId": "example_value",
  "revenueType": "standard",
  "location_lat": 79.13,
  "location_lng": 45.98,
  "ip": "example_value",
  "idfa": "example_value",
  "idfv": "example_value",
  "adid": "example_value",
  "android_id": "500123",
  "event_id": 714,
  "session_id": 794,
  "insert_id": "500123"
}